title,keywords,category
Brand Voice vs Tone of Voice: Key Differences Explained,brand voice,tone of voice,branding,marketing,Brand Strategy
How to Create a Consistent Brand Voice That Converts,brand voice,content strategy,marketing,conversions,Brand Strategy
The Role of AI in Content Creation,AI content,content creation,automation,writing tools,Content Creation
10 Marketing Trends for 2025,marketing trends,digital marketing,strategy,marketing
Essential AI Tools for Content Creators,AI tools,content creation,productivity,marketing,AI Tools


